ID,TITLE,TOPIC_TITLE
m-741978532-1651758720,李克强主持召开国务院常务会议部署进一步为中小微企业和个体工商户纾困举措 以保市场主体稳就业确定推动外贸保稳提质的措施 助力稳经济稳产业链供应链,宏观
m-695220718-1651065420,李克强主持召开国务院常务会议决定加大稳岗促就业政策力度 保持就业稳定和经济平稳运行听取交通物流保通保畅工作汇报 要求进一步打通堵点畅通循环,就业
m-758543456-1650462600,李克强主持召开国务院常务会议部署进一步抓好春季农业生产的措施 确保粮食丰收和重要农产品稳定供应确定能源保供增供举措 提升能源对经济社会发展的保障能力,交通运输
m-978410398-1649855760,李克强主持召开国务院常务会议 部署促进消费的政策举措 助力稳定经济基本盘和保障改善民生 决定进一步加大出口退税等政策支持力度 促进外贸平稳发展 确定加大金融支持实体经济的措施 引导降低市场主体融资成本,就业
m-786697799-1649252220,李克强主持召开国务院常务会议决定对特困行业实行阶段性缓缴养老保险费政策 加大失业保险支持稳岗和培训力度部署适时运用货币政策工具 更加有效支持实体经济发展,宏观
m-993781349-1648646220,李克强主持召开国务院常务会议要求压实责任落细措施 坚决防止重特大安全事故部署用好政府债券扩大有效投资 促进补短板增后劲和经济稳定增长决定新开工一批条件成熟的水利工程 提高水资源保障和防灾减灾能力,交通运输
m-754197871-1647866220,李克强主持召开国务院常务会议确定实施大规模增值税留抵退税的政策安排 为稳定宏观经济大盘提供强力支撑部署综合施策稳定市场预期 保持资本市场平稳健康发展,宏观
m-569948414-1647263100,李克强主持召开国务院常务会议确定政府工作报告重点任务分工 要求扎实有力抓落实推动经济在爬坡过坎中保持平稳运行,宏观
m-780375500-1644929160,李克强主持召开国务院常务会议听取2021年全国两会建议提案办理情况汇报 要求汇聚众智做好今年政府工作确定促进工业经济平稳增长和服务业特殊困难行业纾困发展的措施,制造业
m-740141958-1642600020,李克强主持召开国务院常务会议部署进一步加强下一阶段特别是春节期间煤电油气运保障和市场保供决定延续实施部分到期的减税降费政策 支持企业纾困和发展,交通运输
m-871920156-1641822600,李克强主持召开国务院常务会议部署加快推进十四五规划纲要和专项规划确定的重大项目 扩大有效投资决定常态化制度化开展药品和高值医用耗材集中带量采购 进一步降低患者医药负担,医药健康
m-741399694-1641302880,李克强主持召开国务院常务会议部署全面实行行政许可事项清单管理的措施 规范权力运行更大程度利企便民决定实施企业信用风险分类管理 推动监管更加公平有效,宏观
m-787660734-1640781480,李克强主持召开国务院常务会议部署做好2022年春运疫情防控工作决定延续实施部分个人所得税优惠政策确定加强乡村教师队伍建设和保障进城务工人员随迁子女就学的措施,新冠疫情
m-594424299-1640240040,李克强主持召开国务院常务会议确定跨周期调节措施 推动外贸稳定发展部署做好区域全面经济伙伴关系协定生效后实施工作,就业
m-667441435-1639572060,李克强主持召开国务院常务会议部署进一步采取市场化方式加强对中小微企业的金融支持确定加大对制造业支持的政策举措 促进实体经济稳定发展,制造业
m-802837454-1638366000,李克强主持召开国务院常务会议部署清理拖欠中小企业账款和保障农民工工资及时足额支付的措施审议通过十四五职业技能培训规划 加快培养高素质劳动者和技术技能人才,就业
m-787709774-1637763840,李克强主持召开国务院常务会议部署完善地方政府专项债券管理 优化资金使用严格资金监管确定深入推进跨省异地就医费用直接结算的措施 进一步便利群众就近看病用药,交通运输
m-817529321-1637157540,李克强主持召开国务院常务会议审议通过十四五推进国家政务信息化规划 加快建设数字政府提升政务服务水平决定设立支持煤炭清洁高效利用专项再贷款 促进绿色低碳发展,绿色发展
m-923995039-1635951120,李克强主持召开国务院常务会议听取国务院第八次大督查情况汇报 要求围绕市场主体需求群众关切和用好政府资金抓实工作审议通过十四五推进农业农村现代化规划 促进乡村振兴和农民收入较快增长,农业农村
m-865573984-1635344160,李克强主持召开国务院常务会议部署对制造业中小微企业等实施阶段性税收缓缴措施 进一步加大助企纾困力度决定延长境外投资者投资境内债券市场税收优惠政策 促进对外开放和吸引外资,制造业
m-962086478-1634739180,李克强主持召开国务院常务会议部署做好秋收和秋冬种工作 为保障粮食安全和物价平稳提供有力支撑听取民生用能保供情况汇报 要求确保人民群众安全温暖过冬要求进一步加大对中小微企业纾困的政策支持力度,民生扶贫
m-687361079-1633692060,李克强主持召开国务院常务会议进一步部署做好今冬明春电力和煤炭等供应 保障群众基本生活和经济平稳运行通过中华人民共和国黄河保护法(草案),能源
m-966473850-1632310200,李克强主持召开国务院常务会议要求做好跨周期调节 稳定合理预期保持经济平稳运行审议通过十四五新型基础设施建设规划 推动扩内需促转型增后劲部署加快中小型病险水库除险加固 提升供水和防灾减灾能力,基建
m-813805093-1631707380,李克强主持召开国务院常务会议审议通过十四五全民医疗保障规划 部署健全医保制度体系更好满足群众就医用药需求通过地下水管理条例(草案) 强化地下水资源节约与保护,医药健康
m-795304771-1631101080,李克强主持召开国务院常务会议部署在部分城市开展营商环境创新试点 支持地方深化改革先行先试更大力度利企便民通过证券期货行政执法当事人承诺制度实施办法(草案),宏观
m-1066264782-1630497600,李克强主持召开国务院常务会议部署加大对市场主体特别是中小微企业纾困帮扶力度 加强政策储备做好跨周期调节决定强化国家助学贷款支持 让更多家庭经济困难学生安心求学通过中华人民共和国农产品质量安全法(修订草,宏观
m-660833995-1629890400,李克强主持召开国务院常务会议部署全面推动长江经济带发展的财税支持措施审议通过中国妇女发展纲要(20212030年)和中国儿童发展纲要(20212030年),区域发展
m-740631181-1629114000,李克强主持召开国务院常务会议要求抓好政策落实 针对经济运行新情况加强跨周期调节审议通过十四五就业促进规划 全面强化就业优先政策推动就业扩容提质,就业
m-815598079-1627471080,李克强主持召开国务院常务会议部署进一步改革完善中央财政科研经费管理 给予科研人员更大经费管理自主权确定稳定生猪产能的措施 促进保供稳价增强猪肉安全供应保障能力,宏观
m-940616115-1626868860,李克强主持召开国务院常务会议部署抓紧抓实防汛救灾工作 确保人民生命财产安全听取推进金融业对外开放情况汇报 研究深化金融业开放工作确定进一步深化跨境贸易便利化改革优化口岸营商环境的措施,宏观
m-701293818-1626263220,李克强主持召开国务院常务会议部署中央预算执行和其他财政收支审计查出问题整改工作确定完善农村寄递物流体系的措施 更好满足农民生产生活需要,农业农村
m-790747905-1625658720,李克强主持召开国务院常务会议部署进一步推动医保服务高效便民确定加强新就业形态劳动者权益保障的若干政策措施决定加大金融对实体经济支持 推出支持碳减排的措施,绿色发展
m-865738054-1624447920,李克强主持召开国务院常务会议部署十四五时期纵深推进大众创业万众创新 更大激发市场活力促发展扩就业惠民生确定加快发展外贸新业态新模式的措施 推动外贸升级培育竞争新优势,宏观
m-1598938024-1624020300,李克强主持召开国务院常务会议决定针对今年以来农资价格较快上涨对实际种粮农民一次性发放补贴决定扩大粮食作物完全成本保险和种植收入保险实施范围 增强农民抵御风险能力部署进一步推动金融机构减费让利惠企利民确,农业农村
m-807686893-1623239400,李克强主持召开国务院常务会议部署推进实施十四五规划纲要确定的重大工程项目确定深化公立医院薪酬制度改革的措施 更好调动医务人员积极性更优服务人民群众,交通运输
m-544417844-1622029800,李克强主持召开国务院常务会议部署进一步支持小微企业个体工商户纾困和发展确定加强农村义务教育薄弱环节的措施,教育
m-717186569-1621425000,李克强主持召开国务院常务会议部署做好大宗商品保供稳价工作 保持经济平稳运行确定优化公证服务的措施 更好便企惠民通过生猪屠宰管理条例(修订草案),宏观
m-904735518-1620819300,李克强主持召开国务院常务会议决定将部分减负稳岗扩就业政策期限延长到今年底 确定进一步支持灵活就业的措施部署加强对受疫情持续影响行业企业的金融支持通过建设工程抗震管理条例(草案),就业
m-613081334-1620301800,李克强主持召开国务院常务会议部署进一步促进粮食生产稳定发展 切实提高粮食安全保障能力通过中华人民共和国审计法(修正草案),交通运输
m-1050723716-1619524200,李克强主持召开国务院常务会议部署加强县域商业体系建设 促进流通畅通和农民收入农村消费双提升确定知识产权领域放管服改革新举措 更大便利创业创新激发市场主体创造活力部署做好五一假期疫情防控和安全生产等工作,零售消费
m-751232438-1619004660,李克强主持召开国务院常务会议部署进一步实施好常态化财政资金直达机制 更好发挥财政资金惠企利民作用通过中华人民共和国土地管理法实施条例(修订草案),税务
m-620313863-1618400280,李克强主持召开国务院常务会议通过中华人民共和国市场主体登记管理条例(草案) 为培育壮大市场主体和促进公平竞争提供法治保障,宏观
m-799963440-1617795240,李克强主持召开国务院常务会议部署持续推进网络提速降费 更多惠企利民确定建立健全职工基本医保门诊共济保障机制的措施 拓宽个人账户资金使用范围减轻群众医疗负担,交通运输
m-804738767-1617191100,李克强主持召开国务院常务会议围绕更大激发市场主体活力增强发展后劲 推出深化放管服改革新举措部署推进减税降费落实和优化对小微企业和个体工商户等的减税政策,税务
m-1109415712-1616584380,李克强主持召开国务院常务会议部署实施提高制造业企业研发费用加计扣除比例等政策 激励企业创新促进产业升级决定将普惠小微企业贷款延期还本付息政策和信用贷款支持计划进一步延至今年底通过中华人民共和国职业教育,制造业
m-547720753-1615809600,李克强主持召开国务院常务会议确定政府工作报告重点任务分工要求扎实有力抓好落实推动经济稳中加固行稳致远,宏观
m-597585515-1613647800,李克强主持召开国务院常务会议听取2020年全国两会建议提案办理情况汇报要求汇聚众智促进做好政府工作推动经济社会持续健康发展,宏观
m-885789463-1612352760,李克强主持召开国务院常务会议听取区域全面经济伙伴关系协定生效实施国内相关工作汇报 要求以深化改革开放促进产业升级部署完善企业特别是中小微企业退出相关政策 提升市场主体活跃度,区域发展
m-627121770-1611228660,李克强主持召开国务院常务会议部署强化措施完善制度坚决制止涉企乱收费有序做好法定税费征缴工作 确保不增加企业和群众不合理负担,税务
m-857370982-1610719800,李克强主持召开国务院常务会议部署两节期间加强对受疫情灾情影响困难群众和低保等群体的生活保障部署进一步推进药品集中带量采购改革 以常态化制度化措施减轻群众就医负担,医药健康
m-835780743-1610108100,李克强主持召开国务院常务会议部署进一步做好保障能源安全稳定供应确保群众温暖过冬有关工作部署积极推进中华人民共和国传染病防治法修订工作 推动健全传染病防控体系,能源
m-931626733-1609760220,李克强主持召开国务院常务会议听取优化营商环境条例实施情况第三方评估汇报 要求进一步打通落实堵点提升营商环境法治化水平通过中华人民共和国印花税法(草案)和粮食流通管理条例(修订草案),宏观
m-977998208-1609327980,李克强主持召开国务院常务会议听取保障农民工工资支付情况汇报 要求强化措施落实确保农民工按时足额拿到报酬部署切实做好春运疫情防控工作通过行政事业性国有资产管理条例(草案) 加强和完善国有资产监管,宏观
m-797956943-1608636660,李克强主持召开国务院常务会议决定延续普惠小微企业贷款延期还本付息政策和信用贷款支持计划通过防范和处置非法集资条例(草案)和医疗器械监督管理条例(修订草案),金融
m-975423888-1608032520,李克强主持召开国务院常务会议部署优化政务服务便民热线 提高为企便民服务效率和水平决定在全国实施动产和权利担保统一登记 助力企业担保融资通过企业名称登记管理规定(修订草案) 便利和规范企业名称登记,企业发展
m-797491323-1607513520,李克强主持召开国务院常务会议部署促进人身保险扩面提质稳健发展的措施 满足人民群众多样化需求通过医疗保障基金使用监督管理条例(草案)和排污许可管理条例(草案),医药健康
m-733514721-1606909380,李克强主持召开国务院常务会议部署加快做好区域全面经济伙伴关系协定生效实施有关工作 维护自由贸易拓展合作共赢新空间通过政府督查工作条例(草案),区域发展
m-736038072-1606394700,李克强主持召开国务院常务会议确定完善失信约束制度健全社会信用体系的措施 为发展社会主义市场经济提供支撑通过中华人民共和国安全生产法(修正草案),宏观
m-1335687910-1605699300,李克强主持召开国务院常务会议要求按时间表抓紧做好区域全面经济伙伴关系协定落地实施国内相关工作部署提振大宗消费重点消费和促进释放农村消费潜力确定适应消费升级需求支持互联网+旅游发展的措施听取病险水库除险,区域发展
m-1228947650-1605094560,李克强主持召开国务院常务会议听取国务院第七次大督查情况汇报 确保政策落实更好发挥促进经济稳定恢复的重要作用决定在浦东新区开展市场准入一业一证试点 在全国大幅压减建设工程企业和测绘资质并加强监管更大激发,基建
m-792040776-1604662200,李克强主持召开国务院常务会议确定加强财政民生支出保障的措施 增强惠民政策获得感和可持续性部署结合冬季新冠肺炎疫情防控和其他疾病预防 深入开展爱国卫生运动,民生扶贫
m-883151190-1603279800,李克强主持召开国务院常务会议要求进一步抓好财政资金直达机制落实 更好发挥积极财政政策效能决定全面推行证明事项和涉企经营许可事项告知承诺制 以改革更大便利企业和群众办事创业,税务
m-1104853118-1602242520,李克强主持召开国务院常务会议部署进一步做好稳就业工作 确保完成全年目标任务通过新能源汽车产业发展规划 培育壮大绿色发展新增长点决定在粤港澳大湾区部分地方推广实行国际航运相关税收优惠政策 推动更高水平对,绿色发展
m-1021572149-1600861440,李克强主持召开国务院常务会议部署进一步提高上市公司质量 保护投资者权益推动资本市场持续平稳健康发展确定加强全民健身场地设施建设的措施 促进提高人民健康水平通过中华人民共和国海上交通安全法(修订草案),宏观
m-861874414-1600341840,李克强主持召开国务院常务会议确定政务服务跨省通办和提升获得电力服务水平的措施 持续优化企业和群众办事创业环境要求按照两个毫不动摇支持国有企业和民营企业改革发展,基建
m-753275778-1599651000,李克强主持召开国务院常务会议确定支持新业态新模式加快发展带动新型消费的措施 促进经济恢复性增长部署加快医学教育创新发展 为维护人民健康提供人才保障,教育
m-1166854253-1599046800,李克强主持召开国务院常务会议要求坚持稳健的货币政策灵活适度 着眼服务实体经济明确金融控股公司准入规范听取大气重污染成因与治理攻关项目研究成果汇报 部署加强大气污染科学防治促进绿色发展核准海南昌江核电二,绿色发展
m-715979727-1598442780,李克强主持召开国务院常务会议部署防汛救灾和灾后恢复重建工作 支持受灾地区恢复生产保障民生确定围绕保市场主体激发活力深化放管服改革举措,民生扶贫
m-1073366132-1597665720,李克强主持召开国务院常务会议部署深入做好新增财政资金直接惠企利民工作 巩固经济恢复性增长基础要求进一步落实金融支持实体经济的政策措施 助力市场主体纾困发展决定推进师范毕业生教师资格认定改革 促进师范毕,税务
m-958827196-1596022500,李克强主持召开国务院常务会议部署进一步扩大开放稳外贸稳外资 决定深化服务贸易创新发展试点推出支持农民工就业创业新举措 助力保就业保民生为保障统筹防疫和发展 安排进一步加强核酸检测能力建设,新冠疫情
m-674854980-1595417700,李克强主持召开国务院常务会议部署加强新型城镇化建设 补短板扩内需提升群众生活品质确定支持多渠道灵活就业的措施 促进增加居民就业和收入,就业
m-995290129-1594812780,李克强主持召开国务院常务会议部署深入推进大众创业万众创新 重点支持高校毕业生等群体就业创业要求用好地方政府专项债券 加强资金和项目对接提高资金使用效益通过中华人民共和国预算法实施条例(修订草案),企业发展
m-888012606-1594294260,李克强主持召开国务院常务会议部署进一步做好防汛救灾工作 推进重大水利工程建设确定持续优化营商环境激发市场主体活力的措施部署中央预算执行和其他财政收支审计查出问题整改工作,交通运输
m-1157191911-1593603000,李克强主持召开国务院常务会议决定着眼增强金融服务中小微企业能力 允许地方政府专项债合理支持中小银行补充资本金通过保障中小企业款项支付条例(草案) 维护其合法权益部署进一步促进国家高新技术产业开发区深化,企业发展
m-917326290-1592998380,李克强主持召开国务院常务会议部署进一步压缩企业开办时间清理规范行业协会商会收费 为市场主体减负松绑增添活力决定改革完善乡村医生和兽医职业资格制度 为高校相关专业毕业生就业提供便利,企业发展
m-625457260-1592393400,李克强主持召开国务院常务会议部署引导金融机构进一步向企业合理让利助力稳住经济基本盘要求加快降费政策落地见效为市场主体减负,宏观
m-678506023-1591702620,李克强主持召开国务院常务会议确定新增财政资金直接惠企利民的特殊转移支付机制部署支持适销对路出口商品开拓国内市场 帮扶外贸企业渡难关,就业
m-575326466-1590751080,李克强主持召开国务院常务会议确定政府工作报告重点任务分工 要求狠抓政策和工作落实完成全年经济社会发展目标任务,宏观
m-785026046-1589370000,李克强主持召开国务院常务会议部署做好今年全国两会期间各部门听取全国人大代表和政协委员意见建议工作要求把六保作为六稳工作的着力点 稳住经济基本盘,宏观
m-624316268-1588764600,李克强主持召开国务院常务会议听取支持复工复产和助企纾困政策措施落实情况汇报推出和进一步完善相关政策加大稳企业保就业力度,就业
m-796060396-1588073760,李克强主持召开国务院常务会议听取2019年全国两会建议提案办理情况汇报 促进科学民主决策提升政府治理效能部署加快推进信息网络等新型基础设施建设 推动产业和消费升级,基建
m-1077420280-1587468780,李克强主持召开国务院常务会议部署加大对贫困人口低保人员和失业人员的帮扶保障力度决定提高普惠金融考核权重和降低中小银行拨备覆盖率 促进加强对小微企业的金融服务明确帮助服务业小微企业和个体工商户缓解房租压,民生扶贫
m-1053270389-1586863800,李克强主持召开国务院常务会议要求落实落细今年以来出台的支持企业政策措施 助力企业渡难关部署采取有力有效举措促进高校毕业生就业确定加大城镇老旧小区改造力度 推动惠民生扩内需决定延续西部大开发企业所得税优,就业
m-987402756-1586259000,李克强主持召开国务院常务会议推出增设跨境电子商务综合试验区支持加工贸易广交会网上举办等系列举措积极应对疫情影响努力稳住外贸外资基本盘决定延续实施普惠金融和小额贷款公司部分税收支持政策,就业
m-763610692-1585654200,李克强主持召开国务院常务会议确定再提前下达一批地方政府专项债额度 带动扩大有效投资部署强化对中小微企业的金融支持要求加大对困难群体相关补助政策力度,基建
m-728106142-1585049400,李克强主持召开国务院常务会议确定推动制造业和流通业在做好疫情防控同时积极有序复工复产的措施部署进一步提升我国国际航空货运能力 努力稳定供应链,制造业
m-801148255-1584444600,李克强主持召开国务院常务会议部署深入推进放管服改革 培育壮大新动能促进稳就业要求加快重大投资项目开复工 有效补短板惠民生通过农作物病虫害防治条例(草案),基建
m-935360185-1583926200,李克强主持召开国务院常务会议确定应对疫情影响稳外贸稳外资的新举措部署进一步畅通产业链资金链 推动各环节协同复工复产要求更好发挥专项再贷款再贴现政策作用 支持疫情防控保供和企业纾困发展,交通运输
m-1041791663-1583235420,李克强主持召开国务院常务会议部署完善六稳工作协调机制 有效应对疫情影响促进经济社会平稳运行确定支持交通运输快递等物流业纾解困难加快恢复发展的措施决定加大对地方财政支持 提高保基本民生保工资保运转能力,交通运输
m-1030266874-1582630200,李克强主持召开国务院常务会议推出鼓励吸纳高校毕业生和农民工就业的措施确定鼓励金融机构对中小微企业贷款给予临时性延期还本付息安排并新增优惠利率贷款部署对个体工商户加大扶持 帮助缓解疫情影响纾困解难,就业
m-707623385-1582026420,李克强主持召开国务院常务会议部署不误农时切实抓好春季农业生产决定阶段性减免企业社保费和实施企业缓缴住房公积金政策 多措并举稳企业稳就业,交通运输
m-513771400-1581507060,李克强主持召开国务院常务会议进一步部署在全力以赴抓好疫情防控同时加强经济运行调度和调节更好保障供给,新冠疫情
m-638893627-1580904780,李克强主持召开国务院常务会议要求切实做好疫情防控重点医疗物资和生活必需品保供工作确定支持疫情防控和相关行业企业的财税金融政策,医药健康
m-832765124-1579523700,李克强主持召开国务院常务会议进一步部署新型冠状病毒感染的肺炎疫情防控工作 要求有力有效遏制疫情听取脱贫攻坚情况汇报 部署确保打赢脱贫攻坚战工作保障困难群众基本生活,新冠疫情
m-801049531-1578484800,李克强主持召开国务院常务会议部署进一步做好清理政府部门和国有企业拖欠民营企业中小企业账款工作 要求坚决有力一抓到底部署春节期间市场保供稳价和基本民生保障工作,宏观
m-914669845-1578053100,李克强主持召开国务院常务会议确定促进制造业稳增长的措施 稳定经济发展的基本盘部署加快服务外包转型升级 推动服务业优结构上水平通过化妆品监督管理条例(草案) 更好保障质量安全促进产业发展,制造业
