ID,TITLE,TOPIC_TITLE
m-457217324-1637238540,审议国家安全战略20212025年军队功勋荣誉表彰条例和国家科技咨询委员会2021年咨询报告,宏观
m-636579347-1634541000,研究全面总结党的百年奋斗重大成就和历史经验问题会议决定中国共产党第十九届中央委员会第六次全体会议于11月8日至11日在北京召开,宏观
m-1101484733-1630408980,决定2021年11月在北京召开中国共产党第十九届中央委员会第六次全体会议主要议程是中共中央政治局向中央委员会报告工作重点研究全面总结党的百年奋斗的重大成就和历史经验问题审议关于十九届中央第七轮巡视情况,宏观
m-211479632-1627634160,分析研究当前经济形势部署下半年经济工作,宏观
m-548526843-1622445420,听取十四五时期积极应对人口老龄化重大政策举措汇报审议关于优化生育政策促进人口长期均衡发展的决定,能源
m-513492310-1619781120,分析研究当前经济形势和经济工作听取第三次全国国土调查主要情况汇报审议中国共产党组织工作条例,宏观
m-270191290-1617100680,审议关于新时代推动中部地区高质量发展的指导意见,区域发展
m-1089062831-1614329100,讨论国务院拟提请第十三届全国人民代表大会第四次会议审查的中华人民共和国国民经济和社会发展第十四个五年规划和二〇三五年远景目标纲要草案稿和审议的政府工作报告稿审议中国共产党普通高等学校基层组织工作条例,区域发展
m-1494386734-1611819660,审议中央政治局常委会听取和研究全国人大常委会国务院全国政协最高人民法院最高人民检察院党组工作汇报和中央书记处工作报告的综合情况报告关于加强基层治理体系和治理能力现代化建设的意见关于十九届中央第六轮巡视,宏观
m-662057366-1607682780,分析研究2021年经济工作听取中央纪委国家监委工作汇报研究部署2021年党风廉政建设和反腐败工作审议中国共产党地方组织选举工作条例,宏观
m-464316329-1606727400,审议军队政治工作条例中国共产党统一战线工作条例中国共产党党员权利保障条例,教育
m-201955156-1602839100,审议成渝地区双城经济圈建设规划纲要,区域发展
m-566793936-1601287860,研究制定国民经济和社会发展第十四个五年规划和二〇三五年远景目标重大问题审议中国共产党中央委员会工作条例,宏观
m-447686369-1598872320,审议黄河流域生态保护和高质量发展规划纲要和关于十九届中央第五轮巡视情况的综合报告,绿色发展
m-1192267460-1596107220,决定2020年10月在北京召开中国共产党第十九届中央委员会第五次全体会议主要议程是中共中央政治局向中央委员会报告工作研究关于制定国民经济和社会发展第十四个五年规划和二〇三五年远景目标的建议会议分析研究,区域发展
m-374118826-1593422220,审议中国共产党军队党的建设条例和中国共产党基层组织选举工作条例,税务
m-401502596-1589541900,讨论国务院拟提请第十三届全国人民代表大会第三次会议审议的政府工作报告稿,宏观
m-576657358-1587121500,分析国内外新冠肺炎疫情防控形势研究部署抓紧抓实抓细常态化疫情防控工作分析研究当前经济形势部署当前经济工作,新冠疫情
m-465789450-1585308120,分析国内外新冠肺炎疫情防控和经济运行形势 研究部署进一步统筹推进疫情防控和经济社会发展工作,新冠疫情
m-348694550-1582291800,研究新冠肺炎疫情防控工作部署统筹做好疫情防控和经济社会发展工作,新冠疫情
m-1204586538-1579174680,审议中央政治局常委会听取和研究全国人大常委会国务院全国政协最高人民法院最高人民检察院党组工作汇报和中央书记处工作报告的综合情况报告关于十九届中央第四轮巡视情况的综合报告关于2019年中央巡视工作领导小,宏观
m-456197241-1575630780,分析研究2020年经济工作听取中央纪律检查委员会工作汇报研究部署2020年党风廉政建设和反腐败工作,宏观
m-492762243-1575026820,审议中国共产党党和国家机关基层组织工作条例和中国共产党国有企业基层组织工作条例试行,税务
m-437164680-1571896680,研究坚持和完善中国特色社会主义制度推进国家治理体系和治理能力现代化若干重大问题,宏观
m-400217229-1569311100,审议新时代爱国主义教育实施纲要和中国共产党党校行政学院工作条例,教育
m-1701750739-1567160640,决定2019年10月在北京召开中国共产党第十九届中央委员会第四次全体会议主要议程是中共中央政治局向中央委员会报告工作研究坚持和完善中国特色社会主义制度推进国家治理体系和治理能力现代化若干重大问题会议审,宏观
m-580554155-1564480200,分析研究当前经济形势部署下半年经济工作审议中国共产党问责条例和关于十九届中央第三轮巡视情况的综合报告,宏观
m-333711114-1561366740,审议中国共产党机构编制工作条例和中国共产党农村工作条例,农业农村
m-494627469-1557749340,研究部署在全党开展不忘初心牢记使命主题教育工作审议长江三角洲区域一体化发展规划纲要,教育
m-684189614-1555665540,分析研究当前经济形势部署当前经济工作听取2018年脱贫攻坚成效考核等情况汇报对打好脱贫攻坚战提出要求审议中国共产党宣传工作条例,宏观
m-351277811-1553859540,审议中国共产党党组工作条例和中国共产党党员教育管理工作条例,税务
m-1053471431-1550825220,讨论国务院拟提请第十三届全国人民代表大会第二次会议审议的政府工作报告稿审议关于2018年中央巡视工作领导小组重点工作情况报告关于中央脱贫攻坚专项巡视情况的综合报告和党政领导干部考核工作条例,民生扶贫
m-1288362178-1548409920,审议中央政治局常委会听取和研究全国人大常委会国务院全国政协最高人民法院最高人民检察院党组工作汇报和中央书记处工作报告的综合情况报告中共中央关于加强党的政治建设的意见中国共产党重大事项请示报告条例党政领,宏观
m-168634057-1545893340,审议中国共产党政法工作条例,科技
m-456197272-1544690340,分析研究2019年经济工作听取中央纪律检查委员会工作汇报研究部署2019年党风廉政建设和反腐败工作,宏观
m-434405897-1543221180,审议中国共产党农村基层组织工作条例和中国共产党纪律检查机关监督执纪工作规则,农业农村
m-200356736-1540982160,分析研究当前经济形势部署当前经济工作,宏观
m-364234635-1537524300,审议中国共产党支部工作条例试行和20182022年全国干部教育培训规划,教育
m-313065394-1533035580,分析研究当前经济形势和经济工作 审议中国共产党纪律处分条例,宏观
m-317002570-1530263940,审议关于适应新时代要求大力发现培养选拔优秀年轻干部的意见,企业发展
m-383732608-1527760560,审议乡村振兴战略规划20182022年和关于打赢脱贫攻坚战三年行动的指导意见,农业农村
m-433693741-1524472920,分析研究当前经济形势和经济工作审议关于新时代加强党政军警民合力强边固防的意见,宏观
m-396509611-1522402440,听取2017年省级党委和政府脱贫攻坚工作成效考核情况汇报对打好脱贫攻坚战提出要求,民生扶贫
m-1606006706-1519462140,决定2018年2月26日至28日在北京召开中国共产党第十九届中央委员会第三次全体会议讨论了中共中央政治局向中央委员会作的工作报告听取了中共中央关于深化党和国家机构改革的决定稿在党内外一定范围征求意见的,宏观
m-737264628-1454062500,审议中央政治局常委会听取和研究全国人大常委会国务院全国政协最高人民法院最高人民检察院党组工作汇报和中央书记处工作报告的综合情况报告,宏观
m-535091086-1515738360,研究修改宪法部分内容的建议会议决定中国共产党第十九届中央委员会第二次全体会议于1月18日至19日在北京召开,宏观
m-902907853-1514355600,决定2018年1月召开中国共产党第十九届中央委员会第二次全体会议主要议程是讨论研究修改宪法部分内容的建议会议听取中央纪律检查委员会工作汇报研究部署2018年党风廉政建设和反腐败工作,宏观
m-100312451-1512726120,分析研究2018年经济工作,企业发展
m-221628530-1512033180,审议通过中国共产党党务公开条例试行,税务
m-807466497-1509109860,研究部署学习宣传贯彻党的十九大精神审议中共中央政治局关于加强和维护党中央集中统一领导的若干规定和中共中央政治局贯彻落实中央八项规定的实施细则,教育
m-195365993-1505731440,研究拟提请党的十八届七中全会讨论的文件,宏观
m-459077834-1504174380,研究中国共产党第十八届中央委员会第七次全体会议和中国共产党第十九次全国代表大会筹备工作,宏观
m-150077123-1461930780,分析研究当前经济形势和经济工作,就业
m-220633729-1498642140,审议关于巡视31所中管高校党委情况的专题报告,教育
m-466654622-1495798560,审议关于修改〈中国共产党巡视工作条例〉的决定和关于巡视中央意识形态单位情况的专题报告,宏观
m-373345434-1493113800,分析研究当前经济形势和经济工作审议关于巡视中央政法单位情况的专题报告,宏观
m-398249040-1490957460,听取2016年省级党委和政府脱贫攻坚工作成效考核情况汇报对推进脱贫攻坚工作提出要求,民生扶贫
m-926719543-1487677020,讨论国务院拟提请第十二届全国人民代表大会第五次会议审议的政府工作报告稿审议关于巡视中央和国家机关全覆盖情况的专题报告和关于推进两学一做学习教育常态化制度化的意见,宏观
m-901058405-1485077580,决定设立中央军民融合发展委员会审议中央政治局常委会听取和研究全国人大常委会国务院全国政协最高人民法院最高人民检察院党组工作汇报和中央书记处工作报告的综合情况报告,区域发展
m-357526659-1482916320,听取中央纪律检查委员会2016年工作汇报研究部署2017年党风廉政建设和反腐败工作,宏观
m-296339256-1481276040,分析研究2017年经济工作审议通过关于加强国家安全工作的意见,就业
m-706000228-1480504920,审议通过规范党和国家领导人有关待遇等文件中国共产党工作机关条例试行关于县以上党和国家机关党员领导干部民主生活会的若干规定,教育
m-127767351-1474966620,研究全面从严治党重大问题,宏观
m-146855094-1472214420,审议通过健康中国2030规划纲要,能源
m-319766625-1469533320,决定2016年10月在北京召开中国共产党第十八届中央委员会第六次全体会议,区域发展
m-157775068-1467105720,审议通过中国共产党问责条例,科技
m-329489939-1464345480,研究部署规划建设北京城市副中心和进一步推动京津冀协同发展有关工作,区域发展
m-383451776-1458923700,审议通过关于经济建设和国防建设融合发展的意见长江经济带发展规划纲要,区域发展
m-713832783-1456140420,讨论国务院拟提请第十二届全国人民代表大会第四次会议审议的政府工作报告稿和审查的中华人民共和国国民经济和社会发展第十三个五年规划纲要草案稿,宏观
m-648649371-1451468340,听取中央纪律检查委员会2015年工作汇报研究部署2016年党风廉政建设和反腐败工作审议通过关于全面振兴东北地区等老工业基地的若干意见,区域发展
m-940497618-1450088880,分析研究2016年经济工作研究部署城市工作审议通过关于建立健全党和国家功勋荣誉表彰制度的意见中国共产党地方委员会工作条例关于实施全面两孩政策改革完善计划生育服务管理的决定,区域发展
m-654481229-1448269920,审议通过关于打赢脱贫攻坚战的决定关于加强和改进新形势下党校工作的意见听取关于巡视55家国有重要骨干企业有关情况的专题报告,民生扶贫
m-968551604-1444642080,研究制定国民经济和社会发展第十三个五年规划重大问题审议通过中国共产党廉洁自律准则中国共产党纪律处分条例会议决定中国共产党第十八届中央委员会第五次全体会议于10月26日至29日在北京召开,区域发展
m-371370914-1441964640,审议通过了生态文明体制改革总体方案关于繁荣发展社会主义文艺的意见,绿色发展
m-564994786-1438256400,分析研究当前经济形势和经济工作研究进一步推进西藏经济社会发展和长治久安工作决定设立中央统一战线工作领导小组,宏观
m-850336587-1437386880,决定2015年10月在北京召开中国共产党第十八届中央委员会第五次全体会议主要议程是中共中央政治局向中央委员会报告工作研究关于制定国民经济和社会发展第十三个五年规划的建议,区域发展
m-444525866-1435309020,审议中国共产党巡视工作条例修订稿关于推进领导干部能上能下的若干规定试行,宏观
m-212577121-1432895460,审议通过中国共产党党组工作条例试行,税务
m-528300786-1430386740,分析研究当前经济形势和经济工作审议通过中国共产党统一战线工作条例试行京津冀协同发展规划纲要,宏观
m-686408629-1427192820,审议通过关于加快推进生态文明建设的意见审议通过广东天津福建自由贸易试验区总体方案进一步深化上海自由贸易试验区改革开放方案,绿色发展
m-690947829-1423738260,讨论国务院拟提请第十二届全国人民代表大会第三次会议审议的政府工作报告稿审议关于巡视31个省区市和新疆生产建设兵团情况的专题报告,宏观
m-1094103148-1422009780,审议通过国家安全战略纲要听取全国人大常委会国务院全国政协最高人民法院最高人民检察院党组向中央政治局常委会汇报工作的综合情况报告听取关于2014年贯彻执行中央八项规定情况的汇报研究部署下一步改进作风工作,宏观
m-796431108-1419851160,听取中央纪律检查委员会2014年工作汇报研究部署2015年党风廉政建设和反腐败工作审议通过关于加强社会主义协商民主建设的意见关于加强和改进党的群团工作的意见,宏观
m-435384815-1417795200,分析研究2015年经济工作 审议并通过中共中央纪律检查委员会关于周永康严重违纪案的审查报告,企业发展
m-971786566-1412071140,研究全面推进依法治国重大问题总结全党深入开展党的群众路线教育实践活动研究部署巩固扩大教育实践活动成果工作会议决定中国共产党第十八届中央委员会第四次全体会议于10月20日至23日在北京召开,企业发展
m-942091776-1409303100,审议深化党的建设制度改革实施方案中央管理企业负责人薪酬制度改革方案关于合理确定并严格规范中央企业负责人履职待遇业务支出的意见关于深化考试招生制度改革的实施意见,企业发展
m-298390897-1406636940,决定召开十八届四中全会 讨论研究当前经济形势和下半年经济工作,宏观
m-536481258-1404160080,审议深化财税体制改革总体方案关于进一步推进户籍制度改革的意见党的纪律检查体制改革实施方案,税务
m-210399546-1401101520,研究进一步推进新疆社会稳定和长治久安工作,民生扶贫
m-131782409-1398428220,研究当前经济形势和经济工作,就业
m-393344132-1393232280,讨论国务院拟提请第十二届全国人民代表大会第二次会议审议的政府工作报告稿,宏观
m-715251599-1390561920,研究决定中央国家安全委员会设置听取关于一年来贯彻执行中央八项规定情况的汇报研究部署下一步改进作风工作中共中央总书记习近平主持会议,宏观
m-894937699-1388405400,决定成立中央全面深化改革领导小组由习近平任组长听取中央纪律检查委员会2013年工作汇报研究部署2014年党风廉政建设和反腐败工作审议通过党政领导干部选拔任用工作条例修订稿,企业发展
m-258673278-1386065220,分析研究2014年经济工作听取第二次全国土地调查情况汇报,农业农村
m-756198146-1383038580,讨论十八届二中全会以来中央政治局工作研究全面深化改革重大问题审议并同意印发党政机关厉行节约反对浪费条例决定十八届三中全会于11月9日至12日召开,税务
m-182019458-1380577320,审议并同意印发科学发展观学习纲要,教育
m-707438792-1377638280,决定召开十八届三中全会 研究部署了建立健全惩治和预防腐败体系地方政府职能转变和机构改革等工作听取中国上海自由贸易试验区筹备工作汇报,企业发展
m-185152884-1375215360,讨论研究当前经济形势和下半年经济工作,就业
m-283155388-1372155780,对照检查中央八项规定落实情况讨论研究深化改进作风举措,税务
m-259356661-1366366560,研究部署在全党深入开展党的群众路线教育实践活动工,教育
m-360179912-1361644920,决定今年2月26日至28日在北京召开中国共产党第十八届中央委员会第二次全体会议,宏观
m-200416864-1359404280,研究部署加强新形势下党员发展和管理工作,税务
m-345682363-1356973080,听取中央纪律检查委员会工作汇报研究部署2013年党风廉政建设和反腐败工作,民生扶贫
m-325281766-1354621020,审议关于改进工作作风密切联系群众的有关规定分析研究2013年经济工作,民生扶贫
m-215033322-1353054960,对学习宣传贯彻党的十八大精神进行研究部署,教育
m-156663275-1671200100,2022年中央经济工作会议2022年12月15日-16日,宏观
m-156663209-1639136340,2021年中央经济工作会议2021年12月8日-10日,宏观
m-156663147-1608287940,2020年中央经济工作会议2020年12月16日-18日,宏观
m-156663176-1576148460,2019年中央经济工作会议2019年12月10日-12日,宏观
m-156663279-1545616980,2018年中央经济工作会议2018年12月19日-21日,宏观
m-156663364-1513767660,2017年中央经济工作会议2017年12月18日-20日,宏观
m-156663361-1481886120,2016年中央经济工作会议2016年12月14日-16日,宏观
m-156663345-1450693920,2015年中央经济工作会议2015年12月18日-21日,宏观
m-156663300-1418296200,2014年中央经济工作会议2014年12月9日-11日,宏观
m-156663354-1386969240,2013年中央经济工作会议2013年12月10日-13日,宏观
m-156663353-1355690280,2012年中央经济工作会议2012年12月15日-16日,宏观
m-1029842863-1674917880,李克强主持召开国务院常务会议要求持续抓实当前经济社会发展工作 推动经济运行在年初稳步回升部署做好春耕备耕工作 为粮食丰收和重要农产品稳定供应打牢基础要求推动消费加快恢复和保持外贸外资稳定 增强对经济的,企业发展
m-716623007-1672845600,李克强主持召开国务院常务会议部署进一步做好重要民生商品和能源保供稳价等工作 保障群众生活和企业生产需求要求抓实抓细重点民生工作 确保群众过好春节,民生扶贫
m-1008064059-1671635580,李克强主持召开国务院常务会议部署深入抓好稳经济一揽子政策措施落地见效 推动经济巩固回稳基础保持运行在合理区间确定加强重点商品保供稳价措施 保障群众生活需求部署持续做好稳就业保民生工作 兜牢民生底线,民生扶贫
m-805264150-1669215540,李克强主持召开国务院常务会议部署抓实抓好稳经济一揽子政策和接续措施全面落地见效 巩固经济回稳向上基础决定向地方派出督导工作组 促前期已出台政策措施切实落地,宏观
m-1221777228-1666882920,李克强主持召开国务院常务会议部署持续落实好稳经济一揽子政策和接续措施 推动经济进一步回稳向上听取财政金融政策工具支持重大项目建设和设备更新改造情况汇报 部署加快释放扩消费政策效应要求深入落实制造业增量,制造业
m-1769681717-1664286480,李克强主持召开国务院常务会议决定对部分行政事业性收费和保证金实行阶段性缓缴 进一步帮助市场主体减负纾困部署推进政务服务跨省通办扩面增效举措 激发市场活力便利群众生活部署抓好秋粮收获和加强农业农村基础设,农业农村
m-1322528334-1663860180,李克强主持召开国务院常务会议听取国务院第九次大督查情况汇报 要求狠抓政策落实推动经济回稳向上确定深入推进一件事一次办改革举措 为企业和群众增便利确定强化交通物流保通保畅和支持相关市场主体纾困的政策 支,交通运输
m-1655778614-1663168560,李克强主持召开国务院常务会议决定进一步延长制造业缓税补缴期限 加力助企纾困确定专项再贷款与财政贴息配套支持部分领域设备更新改造 扩市场需求增发展后劲部署进一步稳外贸稳外资的举措 助力经济巩固恢复基础确,制造业
m-1638124634-1662650520,李克强主持召开国务院常务会议部署加力支持就业创业的政策 拓展就业空间培育壮大市场主体和经济新动能决定对部分领域设备更新改造贷款阶段性财政贴息和加大社会服务业信贷支持 促进消费发挥主拉动作用部署阶段性支,就业
m-871443508-1661956200,李克强主持召开国务院常务会议听取稳住经济大盘督导和服务工作汇报 部署充分释放政策效能加快扩大有效需求确定进一步优化营商环境降低制度性交易成本的措施 持续为市场主体减负激活力,宏观
m-1817717883-1661351040,李克强主持召开国务院常务会议部署稳经济一揽子政策的接续政策措施 加力巩固经济恢复发展基础决定增加政策性开发性金融工具额度和依法用好专项债结存限额 再次增发农资补贴和支持发电企业发债融资确定缓缴一批行政,宏观
m-1336249159-1660919880,李克强主持召开国务院常务会议部署推动降低企业融资成本和个人消费信贷成本的措施 加大金融支持实体经济力度部署加大困难群众基本生活保障力度的举措 兜牢民生底线确定支持养老托育服务业纾困的措施 帮扶渡过难关,民生扶贫
m-947253731-1659103860,李克强主持召开国务院常务会议部署进一步扩需求举措 推动有效投资和增加消费部署毫不松懈抓好秋粮生产 确保实现全年粮食丰收部署进一步做好防汛抗旱和应对自然灾害工作 切实保障群众生命财产安全,民生扶贫
m-666320944-1658503080,李克强主持召开国务院常务会议部署持续扩大有效需求的政策举措 增强经济恢复发展拉动力确定进一步规范行政裁量权 决定取消和调整一批罚款事项,基建
m-636601285-1657720260,李克强主持召开国务院常务会议部署加力稳岗拓岗的政策举措 确保就业大局稳定要求多措并举扩消费 确定支持绿色智能家电消费的措施,就业
m-660781912-1657117620,李克强主持召开国务院常务会议部署中央预算执行和其他财政收支审计查出问题整改工作确定有序推进电子证照应用的举措 激发市场主体活力,宏观
m-1196324441-1656594540,李克强主持召开国务院常务会议确定政策性开发性金融工具支持重大项目建设的举措 扩大有效投资促进就业和消费部署加大重点工程以工代赈力度 拓展就业岗位带动农民工等增收决定开展提升高水平医院临床研究和成果转化,就业
m-1049046518-1655905680,李克强主持召开国务院常务会议部署继续做好防汛救灾工作 切实保障人民群众生命财产安全听取稳定粮食生产工作汇报 进一步部署确保全年粮食丰收的举措确定加大汽车消费支持的政策 决定完善自然科学基金资助体系的措,交通运输
m-1093843828-1655297820,李克强主持召开国务院常务会议部署支持民间投资和推进一举多得项目的措施 更好扩大有效投资带动消费和就业确定阶段性缓缴中小微企业职工医保单位缴费 加力支持纾困和稳岗决定开展涉企违规收费专项整治 部署缓缴行,就业
m-777721406-1654693500,李克强主持召开国务院常务会议听取稳增长稳市场主体保就业专项督查情况汇报 要求打通堵点完善配套充分发挥政策效应部署进一步稳外贸稳外资举措 提升对外开放水平,国际关系
m-804770129-1654090500,李克强主持召开国务院常务会议 部署加快稳经济一揽子政策措施落地生效 让市场主体和人民群众应知尽知应享尽享 安排进一步加大困难群众救助帮扶力度 兜牢基本民生底线,民生扶贫
m-505142984-1653311040,李克强主持召开国务院常务会议进一步部署稳经济一揽子措施 努力推动经济回归正常轨道确保运行在合理区间,宏观
m-974357872-1652279880,李克强主持召开国务院常务会议要求财政货币政策以就业优先为导向 稳住经济大盘部署进一步盘活存量资产 拓宽社会投资渠道扩大有效投资决定阶段性免除经济困难高校毕业生国家助学贷款利息并允许延期还本,就业
